{
  "schema_version": "0.1.0",
  "id": "cardiology.arterial-pulse.resting-adult",
  "name": "Resting adult arterial pulse wave",
  "summary": "The pressure/flow pulse launched by cardiac ejection and propagated through the arterial system, represented here by its time-varying pulse frequency over the typical resting-adult range.",
  "domains": [
    "cardiology",
    "hemodynamics",
    "biology"
  ],
  "system": {
    "id": "system.arterial-tree.resting-adult",
    "name": "Resting adult systemic arterial tree",
    "type": "vascular-system"
  },
  "observable": {
    "id": "observable.arterial-pulse.arrival-timing",
    "name": "Arterial pulse-wave arrival timing",
    "quantity_kind": "pulse-arrival-events",
    "independent_coordinate": "time"
  },
  "frequency_profile": {
    "type": "time_varying",
    "axis": {
      "kind": "temporal_frequency"
    },
    "range": {
      "lower": 1,
      "upper": 1.6666666667,
      "unit": "Hz",
      "quantity_kind": "pulse-frequency"
    },
    "representation": "frequency_track",
    "estimator": "inverse pulse-to-pulse interval"
  },
  "conditions": [
    {
      "id": "condition.arterial-pulse.resting",
      "property": "activity-state",
      "operator": "equals",
      "value": "resting"
    },
    {
      "id": "condition.arterial-pulse.adult",
      "property": "population",
      "operator": "equals",
      "value": "adult"
    }
  ],
  "relationships": [
    {
      "id": "relationship.arterial-pulse-to-ppg",
      "type": "TRANSDUCES_TO",
      "category": "physical",
      "source_ref": {
        "id": "cardiology.arterial-pulse.resting-adult"
      },
      "target_ref": {
        "id": "wearable.ppg.resting-adult-pulse",
        "scope": "atlas",
        "label": "Resting adult PPG pulse waveform"
      },
      "description": "Peripheral arterial blood-volume changes alter optical absorption/reflection and are transduced by a PPG sensor into an optical intensity waveform.",
      "evidence": {
        "basis": "established_reference",
        "review_status": "reviewed",
        "source_refs": [
          {
            "id": "source.charlton.arterial-pulse-ppg"
          }
        ],
        "mechanism_status": "known"
      }
    }
  ],
  "sources": [
    {
      "id": "source.aha.arterial-resting-rate",
      "type": "web",
      "title": "Target Heart Rates Chart",
      "publisher": "American Heart Association",
      "url": "https://www.heart.org/en/healthy-living/exercise-and-physical-activity/fitness-basics/target-heart-rates",
      "accessed": "2026-09-02",
      "license": {
        "status": "terms_apply"
      }
    },
    {
      "id": "source.charlton.arterial-pulse-ppg",
      "type": "paper",
      "title": "Wearable Photoplethysmography for Cardiovascular Monitoring",
      "authors": [
        "Peter H. Charlton",
        "Panicos A. Kyriacou"
      ],
      "publisher": "Proceedings of the IEEE",
      "url": "https://pmc.ncbi.nlm.nih.gov/articles/PMC7612541/",
      "doi": "10.1109/JPROC.2022.3149785",
      "issued": "2022-01-27",
      "license": {
        "spdx": "CC-BY-4.0",
        "url": "https://creativecommons.org/licenses/by/4.0/",
        "status": "licensed"
      }
    }
  ],
  "provenance": [
    {
      "target": "/frequency_profile/range",
      "evidence": {
        "basis": "computed_derivation",
        "review_status": "reviewed",
        "source_refs": [
          {
            "id": "source.aha.arterial-resting-rate"
          },
          {
            "id": "source.charlton.arterial-pulse-ppg"
          }
        ],
        "condition_refs": [
          {
            "id": "condition.arterial-pulse.resting"
          },
          {
            "id": "condition.arterial-pulse.adult"
          }
        ],
        "derivation": "Convert the typical resting-adult rate of 60–100 beats/minute to 1.0–1.6667 cycles/second for the pulse-frequency track. The PPG review distinguishes peripheral pulse-wave timing from ECG electrical timing.",
        "mechanism_status": "known"
      }
    }
  ],
  "tags": [
    "arterial-pulse",
    "pulse-wave",
    "hemodynamics",
    "time-varying",
    "transduction-chain"
  ]
}
